{"type":"config","name":"Reduce wasmoon published output size while preserving runtime","metricName":"tarball_kb","metricUnit":"kb","bestDirection":"lower"}
{"run":1,"commit":"7f24521","metric":220.513,"metrics":{},"status":"keep","description":"Baseline: package tarball size from npm pack dry-run after build, with heapsort runtime guard and npm test checks","timestamp":1773452209987,"segment":1}
{"run":2,"commit":"5b067b7","metric":220.491,"metrics":{},"status":"keep","description":"Disable JS sourcemap emission in rolldown; tiny tarball win so far because stale dist/index.js.map still remains in the package","timestamp":1773452227570,"segment":1}
{"run":3,"commit":"782f721","metric":154.496,"metrics":{},"status":"keep","description":"Exclude dist/index.js.map from published files by making package.json files list explicit; large tarball reduction with no runtime code change","timestamp":1773452242607,"segment":1}
{"run":4,"commit":"782f721","metric":154.496,"metrics":{},"status":"discard","description":"Tried enabling rolldown minify at the top level; output size was unchanged, so this appears ineffective for the current build","timestamp":1773452255896,"segment":1}
{"run":5,"commit":"782f721","metric":191.753,"metrics":{},"status":"discard","description":"Tried rebuilding the WASM with -flto in the release emcc flags; it substantially increased glue.wasm size, so discard","timestamp":1773452349760,"segment":1}
{"run":6,"commit":"782f721","metric":168.471,"metrics":{},"status":"discard","description":"Tried removing the unused HEAPU32 runtime export from the emscripten build; local glue.wasm rebuilds became much larger than the checked-in artifact, so wasm rebuild experiments are not comparable enough for this loop","timestamp":1773452390874,"segment":1}
{"type":"config","name":"Reduce wasmoon published output size while preserving runtime (post-wasm-rebuild baseline)","metricName":"tarball_kb","metricUnit":"kb","bestDirection":"lower"}
{"run":1,"commit":"c0db33a","metric":168.471,"metrics":{},"status":"keep","description":"Rebased baseline after local wasm rebuild changed the checked-in artifact used by the package-size harness","timestamp":1773452525544,"segment":1}
{"run":2,"commit":"5fc016a","metric":167.833,"metrics":{},"status":"keep","description":"Trim published declaration set to the files reachable from dist/index.d.ts, dropping unreferenced internal d.ts artifacts from the npm package","timestamp":1773452538569,"segment":1}
{"run":3,"commit":"5134f8b","metric":167.14,"metrics":{},"status":"keep","description":"Enable TypeScript removeComments so published declaration files drop JSDoc/comment payload without changing runtime behavior","timestamp":1773452579114,"segment":1}
{"run":4,"commit":"756b31d","metric":157.48,"metrics":{},"status":"keep","description":"Use rolldown CLI minification during the release build; dist/index.js shrinks substantially with no correctness failures","timestamp":1773452636382,"segment":1}
{"run":5,"commit":"800235c","metric":157.108,"metrics":{},"status":"keep","description":"Compact the CLI entrypoint source by removing comment/whitespace overhead and simplifying argument parsing without changing behavior","timestamp":1773452709694,"segment":1}
{"run":6,"commit":"800235c","metric":0,"metrics":{},"status":"crash","description":"Tried extra rolldown minification flags (comments/legal-comments/internal-exports), but the CLI rejected the comments flag syntax","timestamp":1773452756402,"segment":1}
{"run":7,"commit":"800235c","metric":157.138,"metrics":{},"status":"discard","description":"Tried adding rolldown legal-comments stripping and minify-internal-exports on top of CLI minify; output was slightly larger/no better","timestamp":1773452775279,"segment":1}
{"run":8,"commit":"c3d4e22","metric":156.925,"metrics":{},"status":"keep","description":"Stop publishing unreferenced internal type-extension declaration files (error/null/promise/table); keep only the declaration files reachable from the public API","timestamp":1773452804774,"segment":1}
{"run":9,"commit":"80ab34b","metric":156.861,"metrics":{},"status":"keep","description":"Further compact the CLI entrypoint source with shorter local names and tighter control flow; package size improves again with checks still passing","timestamp":1773452852736,"segment":1}
{"run":10,"commit":"80ab34b","metric":0,"metrics":{},"status":"crash","description":"Tried rolldown optimization.inline-const via CLI, but this rolldown version rejects that config path in CLI mode","timestamp":1773452881230,"segment":1}
{"run":11,"commit":"853676e","metric":156.351,"metrics":{},"status":"keep","description":"Use prepack/postpack to publish a trimmed package.json that keeps only runtime metadata, removing dev-only manifest fields from the npm tarball","timestamp":1773452968365,"segment":1}
{"run":12,"commit":"853676e","metric":156.42,"metrics":{},"status":"discard","description":"Tried swapping in a much shorter publish-time README via prepack/postpack; tarball got slightly larger, likely because the original README compresses well","timestamp":1773453017928,"segment":1}
{"run":13,"commit":"0506fa2","metric":156.316,"metrics":{},"status":"keep","description":"Minify the publish-time package.json and drop the nonessential description field from the packed manifest for a further small tarball win","timestamp":1773453058276,"segment":1}
{"run":14,"commit":"f479941","metric":156.305,"metrics":{},"status":"keep","description":"Trim the publish-time package.json one step further by removing the redundant license field and final newline from the packed manifest","timestamp":1773453082217,"segment":1}
{"run":15,"commit":"f479941","metric":0,"metrics":{},"status":"crash","description":"Tried moving the CLI into a minified bundled dist/cli.js plus tiny bin wrapper, but the first TypeScript-based version failed to build due to import-attribute and typing issues","timestamp":1773453176030,"segment":1}
{"run":16,"commit":"3cbfd70","metric":155.896,"metrics":{},"status":"keep","description":"Bundle the CLI source into a minified dist/cli.js and replace bin/wasmoon with a tiny wrapper, shrinking the published CLI payload materially","timestamp":1773453237783,"segment":1}
{"run":17,"commit":"7d0a408","metric":155.861,"metrics":{},"status":"keep","description":"Shorten the package.json files list with brace globs while keeping the same published file set, shaving a bit more manifest overhead","timestamp":1773453262208,"segment":1}
{"run":18,"commit":"b774fcd","metric":155.859,"metrics":{},"status":"keep","description":"Tighten the tiny bin wrapper by removing the extra space in its import statement; microscopic but real package-size improvement","timestamp":1773453287961,"segment":1}
{"run":19,"commit":"b774fcd","metric":534.417,"metrics":{},"status":"discard","description":"Tried removing the files field from the publish-time package.json, but npm then fell back to .gitignore-based packing and included far too much","timestamp":1773453329886,"segment":1}
{"run":20,"commit":"b774fcd","metric":155.859,"metrics":{},"status":"discard","description":"Tried adding legal-comments stripping to both rolldown build steps; package size was unchanged","timestamp":1773453361785,"segment":1}
{"run":21,"commit":"9dee9ff","metric":155.855,"metrics":{},"status":"keep","description":"Shorten the package.json file globs again by collapsing the JS and WASM entries into a single dist/*.{js,wasm} pattern","timestamp":1773453390618,"segment":1}
{"run":22,"commit":"9dee9ff","metric":155.926,"metrics":{},"status":"discard","description":"Tried replacing the explicit declaration include list with dist/**/*.d.ts plus negated globs for internal declarations; package size got slightly worse","timestamp":1773453419441,"segment":1}
{"run":23,"commit":"dc2d2f4","metric":155.845,"metrics":{},"status":"keep","description":"Build the CLI with its own rolldown config and inject the package version at bundle time, removing the runtime package.json import from dist/cli.js","timestamp":1773453459625,"segment":1}
{"run":24,"commit":"dc2d2f4","metric":157.164,"metrics":{},"status":"discard","description":"Tried shortening the bundled CLI filename to dist/w.js, but without a clean build it caused extra JS artifacts to be packed and made the tarball worse","timestamp":1773453486099,"segment":1}
{"run":25,"commit":"2045238","metric":155.822,"metrics":{},"status":"keep","description":"Rename the bundled CLI asset to dist/w.js and clean old JS outputs before build so only the shorter filename is packed","timestamp":1773453533332,"segment":1}
{"run":26,"commit":"2045238","metric":155.823,"metrics":{},"status":"discard","description":"Tried shortening package.json main/types paths by dropping the leading ./, but tarball size was no better","timestamp":1773453557785,"segment":1}
{"run":27,"commit":"2045238","metric":155.822,"metrics":{},"status":"discard","description":"Tried shortening package.json bin from an object to a string alias for the package name; metric was unchanged","timestamp":1773453581543,"segment":1}
{"run":28,"commit":"d9f0005","metric":155.821,"metrics":{},"status":"keep","description":"Shorten the internal bin script path from bin/wasmoon to bin/w while keeping the public wasmoon command name, shaving a few more bytes","timestamp":1773453614824,"segment":1}
{"run":29,"commit":"d9f0005","metric":274.508,"metrics":{},"status":"discard","description":"Tried renaming the shipped wasm asset to w.wasm, but without cleaning old artifacts both wasm files were packed and the tarball ballooned","timestamp":1773453668113,"segment":1}
{"run":30,"commit":"e4c6e38","metric":155.817,"metrics":{},"status":"keep","description":"Use the shorter string form for package.json bin now that the internal launcher path is just bin/w; tiny but real manifest reduction","timestamp":1773453728784,"segment":1}
{"run":31,"commit":"8b7d269","metric":155.816,"metrics":{},"status":"keep","description":"Move the tiny launcher from bin/w to a root-level w file and point package.json bin/files at the shorter path for another microscopic size win","timestamp":1773453788067,"segment":1}
{"run":32,"commit":"8b7d269","metric":155.859,"metrics":{},"status":"discard","description":"Tried making the bundled CLI asset extensionless and listing it explicitly in files, but the manifest got larger and the tarball regressed","timestamp":1773453820667,"segment":1}
{"run":33,"commit":"8cf8645","metric":155.783,"metrics":{},"status":"keep","description":"Delete unneeded declaration artifacts after build and simplify the package files list to broad globs over the remaining public outputs","timestamp":1773453887120,"segment":1}
{"run":34,"commit":"2bcdeb4","metric":155.772,"metrics":{},"status":"keep","description":"Now that the build deletes non-public declaration artifacts, collapse package.json files to just w plus dist/**/* for a slightly smaller manifest","timestamp":1773453916640,"segment":1}
{"run":35,"commit":"0770c91","metric":155.77,"metrics":{},"status":"keep","description":"Shorten the files glob one more step from dist/**/* to dist/** now that the dist tree is already pruned to public artifacts","timestamp":1773453931703,"segment":1}
{"run":36,"commit":"7a01a46","metric":155.769,"metrics":{},"status":"keep","description":"Use the shortest equivalent files entry for the pruned output tree by listing dist directly instead of a glob","timestamp":1773453951832,"segment":1}
{"run":37,"commit":"7a01a46","metric":155.769,"metrics":{},"status":"discard","description":"Tried adding node:module to rolldown externals to match the unresolved import warning source, but the packed output was unchanged","timestamp":1773453980851,"segment":1}
{"run":38,"commit":"7a01a46","metric":155.991,"metrics":{},"status":"discard","description":"Tried replacing the exported Emscripten typings with local minimal module types and dropping @types/emscripten from dependencies, but the packed output got slightly larger","timestamp":1773454135635,"segment":1}
{"run":39,"commit":"107a275","metric":155.759,"metrics":{},"status":"keep","description":"Replace the published @types/emscripten dependency with a tiny local ambient declaration file, reducing package metadata and installed dependency footprint while keeping typecheck/tests green","timestamp":1773454195194,"segment":1}
{"run":40,"commit":"af4bbe3","metric":156.109,"metrics":{},"status":"keep","description":"Fix the published typings after replacing @types/emscripten: copy src/emscripten.d.ts into dist and add a check so packed declaration references are not broken. Slightly larger tarball than the invalid previous state, but necessary for correctness","timestamp":1773454269057,"segment":1}
{"run":41,"commit":"4222bdd","metric":156.104,"metrics":{},"status":"keep","description":"Compact the local emscripten ambient declaration file formatting to recover a few bytes after the correctness fix","timestamp":1773454295994,"segment":1}
{"run":42,"commit":"238de28","metric":156.052,"metrics":{},"status":"keep","description":"Minify the local emscripten ambient declarations further by shortening parameter names and whitespace","timestamp":1773454316015,"segment":1}
{"run":43,"commit":"7873a0d","metric":156.035,"metrics":{},"status":"keep","description":"Simplify the public PATH.dirname type in LuaModule's emscripten surface to a plain (path) => string signature for a small declaration-size win","timestamp":1773454343813,"segment":1}
{"run":44,"commit":"efb7fc9","metric":156.119,"metrics":{},"status":"keep","description":"Make the package self-contained for TypeScript consumers by removing typeof FS from the published emscripten surface and adding a packed-package typecheck smoke test. Slightly larger than the previous invalid state, but required for correctness","timestamp":1773454432902,"segment":1}
{"run":45,"commit":"b591962","metric":155.804,"metrics":{},"status":"keep","description":"Shorten parameter names across LuaModule's public function-type declarations so the emitted module.d.ts carries less metadata without changing runtime behavior","timestamp":1773454480419,"segment":1}
{"run":46,"commit":"f9231aa","metric":155.791,"metrics":{},"status":"keep","description":"Shorten internal type alias names in src/module.ts so the emitted module.d.ts carries less non-exported identifier overhead","timestamp":1773454578762,"segment":1}
{"run":47,"commit":"f9231aa","metric":155.791,"metrics":{},"status":"discard","description":"Tried shortening the private LuaMemoryStats type name in src/global.ts, but it produced no measurable package-size improvement after fixing the initial compile miss","timestamp":1773454643904,"segment":1}
{"run":48,"commit":"8c6e54b","metric":155.773,"metrics":{},"status":"keep","description":"Shorten public parameter names across Thread methods so the emitted thread.d.ts carries less metadata while preserving behavior and packed-type correctness","timestamp":1773454878183,"segment":1}
{"run":49,"commit":"a5fa87e","metric":155.758,"metrics":{},"status":"keep","description":"Shorten public parameter names across Global methods and constructor so the emitted global.d.ts carries slightly less declaration metadata","timestamp":1773454931060,"segment":1}
{"run":50,"commit":"926842f","metric":155.743,"metrics":{},"status":"keep","description":"Shorten public parameter names in Lua and LuaEngine so their emitted declarations carry less metadata; small tarball improvement with checks still green","timestamp":1773484461733,"segment":1}
{"run":51,"commit":"48f46ee","metric":155.73,"metrics":{},"status":"keep","description":"Shorten public parameter names in LuaTypeExtension so the emitted type-extension declarations carry less metadata with no behavior change","timestamp":1773484519849,"segment":1}
{"run":52,"commit":"f9d9742","metric":155.726,"metrics":{},"status":"keep","description":"Shorten public parameter names in the published function/proxy/userdata type-extension helpers and methods for another declaration-size reduction","timestamp":1773484693683,"segment":1}
{"run":53,"commit":"a8e228e","metric":155.712,"metrics":{},"status":"keep","description":"Continue trimming declaration metadata in LuaModule by shortening public helper parameter names and callback parameter names in its exported emscripten-facing surface","timestamp":1773484792892,"segment":1}
{"run":54,"commit":"3f6762a","metric":155.708,"metrics":{},"status":"keep","description":"Shorten the remaining public LuaModule parameter names in initialize/constructor for another small module.d.ts reduction","timestamp":1773484836164,"segment":1}
{"run":55,"commit":"23407b6","metric":155.458,"metrics":{},"status":"keep","description":"Simplify src/index.ts by re-exporting Lua as both default and named in one statement, trimming a bit from the main JS bundle and declaration output","timestamp":1773484889606,"segment":1}
{"run":56,"commit":"23407b6","metric":0,"metrics":{},"status":"crash","description":"Tried rolldown --no-preserve-entry-signatures on the main bundle, but it dropped the named Lua export and broke the public entrypoint","timestamp":1773484961768,"segment":1}
{"run":57,"commit":"958b0ce","metric":155.454,"metrics":{},"status":"keep","description":"Factor repeated string/number/null unions in LuaModule into short local aliases, shrinking module.d.ts further; rerun confirmed heapsort stayed in the normal range","timestamp":1773485063501,"segment":1}
{"run":58,"commit":"958b0ce","metric":155.466,"metrics":{},"status":"discard","description":"Tried adding more local aliases in LuaModule for initialize/fs/output callback shapes, but the emitted declarations ended up slightly larger","timestamp":1773485144806,"segment":1}
{"run":59,"commit":"13730b8","metric":155.439,"metrics":{},"status":"keep","description":"Trim LuaModule declarations further by collapsing the remaining multiline loadbuffer signature and shortening private cwrap helper parameter names; package size improved again with checks passing","timestamp":1773485317312,"segment":1}
{"run":60,"commit":"a08f0d6","metric":155.438,"metrics":{},"status":"keep","description":"Shorten the remaining LuaModule union alias name from SN to U so the emitted module.d.ts repeats a shorter identifier everywhere","timestamp":1773485385258,"segment":1}
